{
  "id": "00-hand-test-s-curve",
  "name": "Hand Test S-Curve",
  "compilerVersion": "1.0.0",
  "intentHash": "f7b092715ea4999b",
  "seed": "hand-test-fixed",
  "biome": "meadow-edge",
  "unlocks": [
    "sprig-sentinel"
  ],
  "spellUnlock": null,
  "bossId": null,
  "startingMana": 150,
  "maxHearts": 5,
  "levelModifiers": [],
  "paths": [
    {
      "id": "main",
      "controlPoints": [
        {
          "x": 1443.4107754565775,
          "y": 292.59965777397156
        },
        {
          "x": 1238.862299080938,
          "y": 258.4283096343279
        },
        {
          "x": 890.749672241509,
          "y": 380.23883720859885
        },
        {
          "x": 580.0036906450987,
          "y": 395.3032622858882
        },
        {
          "x": 350.254164095968,
          "y": 533.9631043374538
        },
        {
          "x": 45,
          "y": 512
        }
      ],
      "samples": [
        {
          "x": 1443.4107754565775,
          "y": 292.59965777397156
        },
        {
          "x": 1435.6007279849666,
          "y": 290.8787841792818
        },
        {
          "x": 1427.909423548783,
          "y": 288.68043240236756
        },
        {
          "x": 1420.288026375324,
          "y": 286.249058041311
        },
        {
          "x": 1412.700912752869,
          "y": 283.71228621983346
        },
        {
          "x": 1405.1255478025425,
          "y": 281.14054772485497
        },
        {
          "x": 1397.545808917218,
          "y": 278.58174905413085
        },
        {
          "x": 1389.950790397073,
          "y": 276.0687109257795
        },
        {
          "x": 1382.3321150675124,
          "y": 273.6283801070582
        },
        {
          "x": 1374.684309528128,
          "y": 271.2809897475584
        },
        {
          "x": 1367.003636813567,
          "y": 269.04352162044125
        },
        {
          "x": 1359.2868631400431,
          "y": 266.934020148467
        },
        {
          "x": 1351.533155092603,
          "y": 264.96483915234023
        },
        {
          "x": 1343.7424434805075,
          "y": 263.14787525024377
        },
        {
          "x": 1335.915595251696,
          "y": 261.49370293819817
        },
        {
          "x": 1328.0542679014397,
          "y": 260.0117369670637
        },
        {
          "x": 1320.158434874935,
          "y": 258.7262083523618
        },
        {
          "x": 1312.233200113895,
          "y": 257.6376725366638
        },
        {
          "x": 1304.2830157374792,
          "y": 256.74943082116437
        },
        {
          "x": 1296.3107815907042,
          "y": 256.0869585554813
        },
        {
          "x": 1288.3231147091255,
          "y": 255.65157394375
        },
        {
          "x": 1280.3262994514246,
          "y": 255.43768885733834
        },
        {
          "x": 1272.3268317530062,
          "y": 255.4890142684625
        },
        {
          "x": 1264.332357832171,
          "y": 255.7716956284386
        },
        {
          "x": 1256.3517133760595,
          "y": 256.3215768896241
        },
        {
          "x": 1248.3925215924617,
          "y": 257.12235418717154
        },
        {
          "x": 1240.4649281563095,
          "y": 258.19258170516747
        },
        {
          "x": 1232.5761039723884,
          "y": 259.51800948401103
        },
        {
          "x": 1224.7368264645634,
          "y": 261.11190523950887
        },
        {
          "x": 1216.9432423463657,
          "y": 262.91633044059614
        },
        {
          "x": 1209.1959629033531,
          "y": 264.91050907704584
        },
        {
          "x": 1201.4900787179022,
          "y": 267.05920880369933
        },
        {
          "x": 1193.823262646496,
          "y": 269.3435753290807
        },
        {
          "x": 1186.1939177919187,
          "y": 271.75021875301223
        },
        {
          "x": 1178.5975057882124,
          "y": 274.25888834490115
        },
        {
          "x": 1171.031253074649,
          "y": 276.85713689777424
        },
        {
          "x": 1163.4924401378048,
          "y": 279.5339947120422
        },
        {
          "x": 1155.978434318378,
          "y": 282.279746391411
        },
        {
          "x": 1148.486708445463,
          "y": 285.08574201188475
        },
        {
          "x": 1141.014849601669,
          "y": 287.94423706983446
        },
        {
          "x": 1133.5605610941225,
          "y": 290.8482564327398
        },
        {
          "x": 1126.1216598196322,
          "y": 293.791478253148
        },
        {
          "x": 1118.6960705734834,
          "y": 296.7681344487178
        },
        {
          "x": 1111.2818183918544,
          "y": 299.7729248989024
        },
        {
          "x": 1103.8770196879973,
          "y": 302.80094296868793
        },
        {
          "x": 1096.4798727060206,
          "y": 305.84761035151104
        },
        {
          "x": 1089.088647647418,
          "y": 308.9086195373257
        },
        {
          "x": 1081.7017338092603,
          "y": 311.9800196051684
        },
        {
          "x": 1074.3173941000725,
          "y": 315.05760388514494
        },
        {
          "x": 1066.9339765923053,
          "y": 318.1374002727065
        },
        {
          "x": 1059.5499338317015,
          "y": 321.21569699649905
        },
        {
          "x": 1052.1637452258663,
          "y": 324.28884033555494
        },
        {
          "x": 1044.7739079312557,
          "y": 327.35319820380874
        },
        {
          "x": 1037.3789280486453,
          "y": 330.4051245314752
        },
        {
          "x": 1029.9769438990377,
          "y": 333.4400218057038
        },
        {
          "x": 1022.5666683180912,
          "y": 336.45461195502514
        },
        {
          "x": 1015.1466105270126,
          "y": 339.44503656575785
        },
        {
          "x": 1007.715246748266,
          "y": 342.407246573998
        },
        {
          "x": 1000.2710274529725,
          "y": 345.33699443631195
        },
        {
          "x": 992.8123715937832,
          "y": 348.22978945163703
        },
        {
          "x": 985.3376618462679,
          "y": 351.08084889311806
        },
        {
          "x": 977.8448086123922,
          "y": 353.88387466508135
        },
        {
          "x": 970.3324181301753,
          "y": 356.63408959459747
        },
        {
          "x": 962.798908653336,
          "y": 359.325889811849
        },
        {
          "x": 955.2425411707817,
          "y": 361.9528109582493
        },
        {
          "x": 947.6615505163355,
          "y": 364.5077716495052
        },
        {
          "x": 940.0541583125502,
          "y": 366.98297893012847
        },
        {
          "x": 932.4185929780227,
          "y": 369.3698207752153
        },
        {
          "x": 924.7531190695399,
          "y": 371.65874380782367
        },
        {
          "x": 917.0560789204679,
          "y": 373.83911433685813
        },
        {
          "x": 909.3259504156833,
          "y": 375.89906086311595
        },
        {
          "x": 901.5614258509524,
          "y": 377.82529642471496
        },
        {
          "x": 893.7603642460869,
          "y": 379.5976280400872
        },
        {
          "x": 885.9231563143148,
          "y": 381.20231876842536
        },
        {
          "x": 878.0521239512805,
          "y": 382.6321756667868
        },
        {
          "x": 870.1507524834168,
          "y": 383.88367142025334
        },
        {
          "x": 862.2250727308382,
          "y": 384.9703617976646
        },
        {
          "x": 854.2794564252115,
          "y": 385.90002547283535
        },
        {
          "x": 846.3178048888466,
          "y": 386.6806103505311
        },
        {
          "x": 838.3435873657588,
          "y": 387.32043688170705
        },
        {
          "x": 830.3598417297874,
          "y": 387.82813056352575
        },
        {
          "x": 822.3691833239172,
          "y": 388.2125640167777
        },
        {
          "x": 814.3738202905415,
          "y": 388.4828092203333
        },
        {
          "x": 806.3755739015741,
          "y": 388.648100074787
        },
        {
          "x": 798.3758981172806,
          "y": 388.71611835149304
        },
        {
          "x": 790.3759537938033,
          "y": 388.6982131335259
        },
        {
          "x": 782.3765374482034,
          "y": 388.60436513698914
        },
        {
          "x": 774.378167622189,
          "y": 388.44424367352167
        },
        {
          "x": 766.3811213871547,
          "y": 388.22763325332477
        },
        {
          "x": 758.3854655907247,
          "y": 387.96444887484006
        },
        {
          "x": 750.3910889851269,
          "y": 387.6647580486652
        },
        {
          "x": 742.3977354942296,
          "y": 387.3388089292712
        },
        {
          "x": 734.4050390540189,
          "y": 386.99706393159425
        },
        {
          "x": 726.4125606297974,
          "y": 386.65023819286125
        },
        {
          "x": 718.4198281740413,
          "y": 386.30934219075453
        },
        {
          "x": 710.4263804418991,
          "y": 385.98572773451815
        },
        {
          "x": 702.4318157245873,
          "y": 385.691136392416
        },
        {
          "x": 694.4358466888407,
          "y": 385.4377491927025
        },
        {
          "x": 686.4383626126896,
          "y": 385.2382361208882
        },
        {
          "x": 678.4395003673548,
          "y": 385.1058035185081
        },
        {
          "x": 670.4397254870197,
          "y": 385.05423695437275
        },
        {
          "x": 662.4399245576413,
          "y": 385.0979364793094
        },
        {